{
  "captureRef": "rc10wk-s01-capture-20260926-01",
  "knowledgeRef": "issue:01a0ddde-0d24-7978-9af4-6ed850a5cbfc@rev:10",
  "workspaceRef": "0b02adb6-a395-46bd-bd92-6fec14dee20e",
  "projectRef": "43aec4ec-3ebb-4d1b-aa54-7766c48379c1",
  "proposalRef": "rc10wk-s01-verified-slice-procedure-20260926-01",
  "sourceRefs": [
    "learningSource:rc10-local-s01-learning-source-20260926-01",
    "issue:01a0dd73-7d75-7295-aeb1-a83905eb2312"
  ],
  "evidenceRefs": [
    "comment:01a0ddc8-5eff-7685-b055-2906b34b3266",
    "comment:01a0ddd3-97bc-7037-9dbb-94cf79f29e35",
    "run:01a0ddcd-3d0b-7dc3-ae46-305889037b53"
  ],
  "capturedAt": "2026-09-26T13:18:32Z"
}
